,country,countrystd,date,date1,date2,lat,lon,text,source,alltext
186,Kazakhstan,Kazakhstan,20.03.2020,2020-03-20,20200320,48.16065181963416,67.29596466823361," International restrictions ›All foreign nationals are barred entry into the country from 08.00 (local time) on 16 March until at least 07.00 (local time) on 15 April. Categories of foreign nationals that are exempt from this restriction are ›Diplomatic personnel and their family members. ›Members of official delegations invited by the Ministry of Foreign Affairs of Kazakhstan. ›Members of train, locomotive, aircraft and sea crews. ›Family members of citizens of Kazakhstan (subject to confirmation of kinship – spouses, parents and children). ›Foreigners (stateless persons), holders of Kazakh residence permits ›Service personnel of foreign cross-border facilities on the territory of Kazakhstan ›All foreigners currently in Kazakhstan are allowed to depart. ›Kazakh nationals are exempt from inbound travel restrictions but are not allowed to leave the country. ›While no information has yet emerged, further reduction of inbound and outbound international flights is expected over the coming days. Earlier in the month, Kazakh authorities suspended all flights to Iran, while flights to and from Azerbaijan, Germany, Japan, Singapore and Thailand have been reduced. ", https://pandemic.internationalsos.com/2019-ncov/ncov-travel-restrictions-flight-operations-and-screening ,"Kazakhstan: International restrictions: ›All foreign nationals are barred entry into the country from 08.00 (local time) on 16 March until at least 07.00 (local time) on 15 April. Categories of foreign nationals that are exempt from this restriction are: ›Diplomatic personnel and their family members. ›Members of official delegations invited by the Ministry of Foreign Affairs of Kazakhstan. ›Members of train, locomotive, aircraft and sea crews. ›Family members of citizens of Kazakhstan (subject to confirmation of kinship – spouses, parents and children). ›Foreigners (stateless persons), holders of Kazakh residence permits ›Service personnel of foreign cross-border facilities on the territory of Kazakhstan ›All foreigners currently in Kazakhstan are allowed to depart. ›Kazakh nationals are exempt from inbound travel restrictions but are not allowed to leave the country. ›While no information has yet emerged, further reduction of inbound and outbound international flights is expected over the coming days. Earlier in the month, Kazakh authorities suspended all flights to Iran, while flights to and from Azerbaijan, Germany, Japan, Singapore and Thailand have been reduced. Source: https://pandemic.internationalsos.com/2019-ncov/ncov-travel-restrictions-flight-operations-and-screening Published on 20.03"
187,Iran (Islamic Republic of),Iran,20.03.2020,2020-03-20,20200320,32.57067810617728,54.27694668562727," International restrictions ›All neighbouring countries to Iran have closed joint borders. ›All flights from mainland China are banned until further notice. ›Passport holders from People’s Republic of China (PRC), Hong Kong (China SAR) and Macao (China SAR) are no longer visa exempt, but must instead obtain a visa upon arrival after undergoing a medical examination. ›IranAir has suspended all flights to and from European destinations until further notice. ›All neighbouring countries to Iran - aside from Afghanistan – have closed joint borders, and a number of countries have banned flights from Iran. ", https://pandemic.internationalsos.com/2019-ncov/ncov-travel-restrictions-flight-operations-and-screening ,"Iran (Islamic Republic of): International restrictions: ›All neighbouring countries to Iran have closed joint borders. ›All flights from mainland China are banned until further notice. ›Passport holders from People’s Republic of China (PRC), Hong Kong (China SAR) and Macao (China SAR) are no longer visa exempt, but must instead obtain a visa upon arrival after undergoing a medical examination. ›IranAir has suspended all flights to and from European destinations until further notice. ›All neighbouring countries to Iran - aside from Afghanistan – have closed joint borders, and a number of countries have banned flights from Iran. Source: https://pandemic.internationalsos.com/2019-ncov/ncov-travel-restrictions-flight-operations-and-screening Published on 20.03"
188,Kenya,Kenya,20.03.2020,2020-03-20,20200320,0.5507660694242262,37.822439919016496, International restrictions ›Kenya on 15 March issued an entry ban on all travellers coming from countries with reported COVID-19 cases. There are exemptions for Kenyan citizens as well as foreigners with valid residence visas as long as they go through self-quarantine. This travel ban will come into effect within 48 hours of announcement and will last for 30 days. ›All travellers who have entered Kenya in the last 14 days will need to self-quarantine. ›All flights from China have been suspended until further notice. ›All international meetings and conferences have been banned for 30 days during March. Internal restrictions ›The governor of Murang’a has banned incoming travellers from other counties. , https://pandemic.internationalsos.com/2019-ncov/ncov-travel-restrictions-flight-operations-and-screening ,Kenya: International restrictions: ›Kenya on 15 March issued an entry ban on all travellers coming from countries with reported COVID-19 cases. There are exemptions for Kenyan citizens as well as foreigners with valid residence visas as long as they go through self-quarantine. This travel ban will come into effect within 48 hours of announcement and will last for 30 days. ›All travellers who have entered Kenya in the last 14 days will need to self-quarantine. ›All flights from China have been suspended until further notice. ›All international meetings and conferences have been banned for 30 days during March. Internal restrictions: ›The governor of Murang’a has banned incoming travellers from other counties. Source: https://pandemic.internationalsos.com/2019-ncov/ncov-travel-restrictions-flight-operations-and-screening Published on 20.03
189,Czechia,Czechia,21.03.2020,2020-03-21,20200321,49.732448205225474,15.314103102020699," Passengers are not allowed to enter Czechia. - This does not apply to nationals of Czechia. - This does not apply to passengers with a Czech residence permit for stay over 90 days or for permanent stay. - This does not apply to passengers with a Czech long-stay visa (not including visa stickers with a national comment D/VR/XX). - This does not apply to passengers with the European Health Insurance Card issued by Czechia. - This does not apply to passengers with diplomatic and service passports issued by Czechia. - This does not apply to passengers who are minors younger than 18, if their parent is a citizen of Czechia; and a parent of a minor younger than 18 if this minor is a citizen of Czechia. - This does not apply to members of the mission under the Vienna Convention on Diplomatic Relations and members of the consular posts under the Vienna Convention on Consular Relations accredited in Czechia, and officials of international organizations based in Czechia registered with Ministry of the Foreign Affairs of Czechia, including their family members. - This does not apply to nationals of the European Union transiting through Czechia on their way home. This evidence of transit must be accompanied with a signed declaration of honor. - This does not apply to passengers with a residence permit issued by another European Union country transiting through Czechia on their way home. This evidence of transit must be accompanied with a signed declaration of honor. ", https://www.iatatravelcentre.com/international-travel-document-news/1580226297.htm ,"Czechia: Passengers are not allowed to enter Czechia. - This does not apply to nationals of Czechia. - This does not apply to passengers with a Czech residence permit for stay over 90 days or for permanent stay. - This does not apply to passengers with a Czech long-stay visa (not including visa stickers with a national comment D/VR/XX). - This does not apply to passengers with the European Health Insurance Card issued by Czechia. - This does not apply to passengers with diplomatic and service passports issued by Czechia. - This does not apply to passengers who are minors younger than 18, if their parent is a citizen of Czechia; and a parent of a minor younger than 18 if this minor is a citizen of Czechia. - This does not apply to members of the mission under the Vienna Convention on Diplomatic Relations and members of the consular posts under the Vienna Convention on Consular Relations accredited in Czechia, and officials of international organizations based in Czechia registered with Ministry of the Foreign Affairs of Czechia, including their family members. - This does not apply to nationals of the European Union transiting through Czechia on their way home. This evidence of transit must be accompanied with a signed declaration of honor. - This does not apply to passengers with a residence permit issued by another European Union country transiting through Czechia on their way home. This evidence of transit must be accompanied with a signed declaration of honor. Source: https://www.iatatravelcentre.com/international-travel-document-news/1580226297.htm Published on 21.03"
190,Cuba,Cuba,21.03.2020,2020-03-21,20200321,21.625298045111972,-79.03521174285737, Cuba closes borders , https://news.yahoo.com/cuba-bolivia-close-borders-brazil-slashes-growth-expectations-234808943.html ,Cuba: Cuba closes borders Source: https://news.yahoo.com/cuba-bolivia-close-borders-brazil-slashes-growth-expectations-234808943.html Published on 21.03
191,Croatia,Croatia,21.03.2020,2020-03-21,20200321,45.067726146614696,16.398548733894046," Passengers are prohibited from crossing the borders of Croatia until 18 April 2020. - This does not apply to nationals of Croatia and their family members and to those going to a country where they work and live. - This does not apply to nationals of the EU, Schengen Member States and the Schengen Associated States, passengers from the United Kingdom, and their family members. - This does not apply to passengers with a long-term resident permit or a long-term visa issued by a Schengen Member State and the persons deriving their right to reside from other EU Directives or national law or who hold national long-term visas. - This does not apply to healthcare professionals, healthcare researchers and collaborators, experts in care for the elderly, and persons requiring urgent medical treatment. - This does not apply to cross-border workers. - This does not apply to diplomats, police officers in the performance of their activities, Civil Defence services and teams, international organizations staff and International military personnel in carrying out their functions. - This does not apply to passengers in transit (including passengers in transit by air transport). ", https://www.iatatravelcentre.com/international-travel-document-news/1580226297.htm ,"Croatia: Passengers are prohibited from crossing the borders of Croatia until 18 April 2020. - This does not apply to nationals of Croatia and their family members and to those going to a country where they work and live. - This does not apply to nationals of the EU, Schengen Member States and the Schengen Associated States, passengers from the United Kingdom, and their family members. - This does not apply to passengers with a long-term resident permit or a long-term visa issued by a Schengen Member State and the persons deriving their right to reside from other EU Directives or national law or who hold national long-term visas. - This does not apply to healthcare professionals, healthcare researchers and collaborators, experts in care for the elderly, and persons requiring urgent medical treatment. - This does not apply to cross-border workers. - This does not apply to diplomats, police officers in the performance of their activities, Civil Defence services and teams, international organizations staff and International military personnel in carrying out their functions. - This does not apply to passengers in transit (including passengers in transit by air transport). Source: https://www.iatatravelcentre.com/international-travel-document-news/1580226297.htm Published on 21.03"
192,Comoros,Comoros,21.03.2020,2020-03-21,20200321,-11.884216211489898,43.68016318654981," Passengers who have transited or have been in China (People's Rep.), Egypt, France, Iran, Italy, Morocco, South Africa, Spain or Tunisia are not allowed to enter Comoros.All airports in Comoros are closed. ", https://www.iatatravelcentre.com/international-travel-document-news/1580226297.htm ,"Comoros: Passengers who have transited or have been in China (People's Rep.), Egypt, France, Iran, Italy, Morocco, South Africa, Spain or Tunisia are not allowed to enter Comoros.All airports in Comoros are closed. Source: https://www.iatatravelcentre.com/international-travel-document-news/1580226297.htm Published on 21.03"
193,Colombia,Colombia,21.03.2020,2020-03-21,20200321,3.9094130758617975,-73.08384204197671," Colombia prepares to enter quarantine International restrictions ›Border closure for all foreign travellers from 17 March to 30 MAY. Colombian nationals and residents will not be allowed to enter or depart the country by land or sea; however, they will be subject to mandatory self-quarantine for 14 days upon their return. ›President Ivan Duque announced on 13 March that travellers who have been to Asia and in the past 14 days will be banned. He did not define which countries in Asia and Europe are included in the restrictions. ›Colombian nationals and residents will NOT be allowed to enter or depart the country by land or sea from 17 March to 30 May. ›Foreign nationals are still able to depart from Colombia. ›On 19 March, President Duque announced that all international flights to Colombia will be suspended for 30 days, beginning 23 March. All travellers, including Colombian citizens and permanent residents, will be barred entry during this time. ", https://www.aljazeera.com/news/2020/03/coronavirus-colombia-prepares-enter-quarantine-200321061814774.html https://pandemic.internationalsos.com/2019-ncov/ncov-travel-restrictions-flight-operations-and-screening ,"Colombia: Colombia prepares to enter quarantine International restrictions: ›Border closure for all foreign travellers from 17 March to 30 MAY. Colombian nationals and residents will not be allowed to enter or depart the country by land or sea; however, they will be subject to mandatory self-quarantine for 14 days upon their return. ›President Ivan Duque announced on 13 March that travellers who have been to Asia and in the past 14 days will be banned. He did not define which countries in Asia and Europe are included in the restrictions. ›Colombian nationals and residents will NOT be allowed to enter or depart the country by land or sea from 17 March to 30 May. ›Foreign nationals are still able to depart from Colombia. ›On 19 March, President Duque announced that all international flights to Colombia will be suspended for 30 days, beginning 23 March. All travellers, including Colombian citizens and permanent residents, will be barred entry during this time. Source: https://www.aljazeera.com/news/2020/03/coronavirus-colombia-prepares-enter-quarantine-200321061814774.html https://pandemic.internationalsos.com/2019-ncov/ncov-travel-restrictions-flight-operations-and-screening Published on 21.03"
194,China,China,21.03.2020,2020-03-21,20200321,36.56011515322799,103.83157174451135," Starting 16 March 2020, all passengers arriving at Beijing from overseas will be put on 14-day quarantine at designated facilities equipped with healthcare services, Expenses incurred will be paid by travelers themselves. Moreover, people who return to the country through other city ports but arrived in Beijing also must report their detailed health information to local authorities. Shanghai's government on 17 March further enhanced its COVID-19 prevention and control efforts by extending quarantine measures to inbound travelers from 16 countries. The countries include South Korea, Italy, Iran, Japan, France, Spain, Germany, the United States, the United Kingdom, Switzerland, Sweden, Belgium, Norway, the Netherlands, Denmark and Austria. Travellers from these countries must undergo 14-day quarantine at home or in designated places for medical observation. The city of Wuhan, where the coronavirus outbreak first began in late December, said it will require all overseas returnees to the city to be centrally quarantined for 14 days at their own cost. Starting from 0000 on 20 March 2020, the first designated entry point to China for some international flights destined to PEK will be changed as follows (all in BJS time) CA910 SVO – PEK on 20th March, CA 934 CDG- PEK on 22nd March, the first entry point will be TSN.  CA926 NRT – PEK on 20th -22nd March, the first entry point will be HET  HU7976 YYZ – PEK on 21st – 22nd March, the first entry point will be TYN  The passengers on these flights will go through CIQ at the first entry point with luggage clearance, quarantine qualified passengers will continue flying to PEK. Belly cargo clearance will be in PEK. This arrangement will be adjusted subject to the epidemic evolvement. ", Sources ,"China: Starting 16 March 2020, all passengers arriving at Beijing from overseas will be put on 14-day quarantine at designated facilities equipped with healthcare services, Expenses incurred will be paid by travelers themselves. Moreover, people who return to the country through other city ports but arrived in Beijing also must report their detailed health information to local authorities. Shanghai's government on 17 March further enhanced its COVID-19 prevention and control efforts by extending quarantine measures to inbound travelers from 16 countries. The countries include South Korea, Italy, Iran, Japan, France, Spain, Germany, the United States, the United Kingdom, Switzerland, Sweden, Belgium, Norway, the Netherlands, Denmark and Austria. Travellers from these countries must undergo 14-day quarantine at home or in designated places for medical observation. The city of Wuhan, where the coronavirus outbreak first began in late December, said it will require all overseas returnees to the city to be centrally quarantined for 14 days at their own cost. Starting from 00:00 on 20 March 2020, the first designated entry point to China for some international flights destined to PEK will be changed as follows (all in BJS time) CA910 SVO – PEK on 20th March, CA 934 CDG- PEK on 22nd March, the first entry point will be TSN.  CA926 NRT – PEK on 20th -22nd March, the first entry point will be HET  HU7976 YYZ – PEK on 21st – 22nd March, the first entry point will be TYN  The passengers on these flights will go through CIQ at the first entry point with luggage clearance, quarantine qualified passengers will continue flying to PEK. Belly cargo clearance will be in PEK. This arrangement will be adjusted subject to the epidemic evolvement. Source: Sources Published on 21.03"
195,British Virgin Islands,British Virgin Is.,21.03.2020,2020-03-21,20200321,18.50988412918695,-64.50286319380177," Travellers who are arriving from or who have transited through countries affected by COVID-19 in the 14 days prior to arrival will be denied entry. Tortola cruise port closed on 14 March, as well as a ban on all cruise ships for 30 days. There are currently no known restrictions on individuals seeking to depart the country. ", https://pandemic.internationalsos.com/2019-ncov/ncov-travel-restrictions-flight-operations-and-screening ,"British Virgin Islands: Travellers who are arriving from or who have transited through countries affected by COVID-19 in the 14 days prior to arrival will be denied entry. Tortola cruise port closed on 14 March, as well as a ban on all cruise ships for 30 days. There are currently no known restrictions on individuals seeking to depart the country. Source: https://pandemic.internationalsos.com/2019-ncov/ncov-travel-restrictions-flight-operations-and-screening Published on 21.03"
196,Burkina Faso,Burkina Faso,21.03.2020,2020-03-21,20200321,12.269553908602479,-1.7555276642134723," International restrictions Closure of Ouagadougou and Bobo Dioulasso international airports from 21 March at 0000 to international commercial flights. Internal flights and military flights will proceed. This will be for two weeks and is renewable from then. Land and rail borders closed from 21 March at 0000 with the exception of freight. Air Burkina has suspended flights to Benin, Mali and Niger. Internal restrictions Curfew introduced from 1900 to 0500 every night from 21 March. State of Health emergency declared countrywide on 16 March. Partial confinement (outside of work hours). Ban on all cultural and religious or family gatherings. Ban on any professional gatherings above 25 people. Closure of all cultural, sports and leisure activities/businesses. Gradual/partial shutdown of airports and screenings at land borders. ALL MASS GATHERINGS of any kind are banned. Schools and universities to be closed from 16 to 31 March. ", https://pandemic.internationalsos.com/2019-ncov/ncov-travel-restrictions-flight-operations-and-screening ,"Burkina Faso: International restrictions: Closure of Ouagadougou and Bobo Dioulasso international airports from 21 March at 00:00 to international commercial flights. Internal flights and military flights will proceed. This will be for two weeks and is renewable from then. Land and rail borders closed from 21 March at 00:00 with the exception of freight. Air Burkina has suspended flights to Benin, Mali and Niger. Internal restrictions: Curfew introduced from 19:00 to 05:00 every night from 21 March. State of Health emergency declared countrywide on 16 March. Partial confinement (outside of work hours). Ban on all cultural and religious or family gatherings. Ban on any professional gatherings above 25 people. Closure of all cultural, sports and leisure activities/businesses. Gradual/partial shutdown of airports and screenings at land borders. ALL MASS GATHERINGS of any kind are banned. Schools and universities to be closed from 16 to 31 March. Source: https://pandemic.internationalsos.com/2019-ncov/ncov-travel-restrictions-flight-operations-and-screening Published on 21.03"
197,Brunei Darussalam,Brunei,21.03.2020,2020-03-21,20200321,4.516500315375067,114.72724575498276," 1. All passengers must undergo self-isolation for 14 days. 2. Passengers who have been in the Hubei, Zhejiang or Jiangsu Provinces (China People's Rep.) in the past 14 days are not allowed to transit or enter Brunei Darussalam. - This does not apply to nationals of Brunei Darussalam. - This does not apply to permanent residents of Brunei Darussalam. 3. Passengers who have been in Austria, Belgium, Bulgaria, Croatia, Cyprus, Czechia, Denmark, Estonia, Finland, France, Germany, Greece, Hungary, Iceland, Ireland (Rep.), Italy, Iran, Latvia, Liechtenstein, Lithuania, Luxembourg, Malta, Netherlands, Norway, Poland, Portugal, Romania, Slovakia, Slovenia, Spain, Sweden, Switzerland or United Kingdom in the past 14 days are not allowed to transit or enter Brunei Darussalam. - This does not apply to nationals of Brunei Darussalam and permanent residents of Brunei Darussalam. ", https://www.iatatravelcentre.com/international-travel-document-news/1580226297.htm ,"Brunei Darussalam: 1. All passengers must undergo self-isolation for 14 days. 2. Passengers who have been in the Hubei, Zhejiang or Jiangsu Provinces (China People's Rep.) in the past 14 days are not allowed to transit or enter Brunei Darussalam. - This does not apply to nationals of Brunei Darussalam. - This does not apply to permanent residents of Brunei Darussalam. 3. Passengers who have been in Austria, Belgium, Bulgaria, Croatia, Cyprus, Czechia, Denmark, Estonia, Finland, France, Germany, Greece, Hungary, Iceland, Ireland (Rep.), Italy, Iran, Latvia, Liechtenstein, Lithuania, Luxembourg, Malta, Netherlands, Norway, Poland, Portugal, Romania, Slovakia, Slovenia, Spain, Sweden, Switzerland or United Kingdom in the past 14 days are not allowed to transit or enter Brunei Darussalam. - This does not apply to nationals of Brunei Darussalam and permanent residents of Brunei Darussalam. Source: https://www.iatatravelcentre.com/international-travel-document-news/1580226297.htm Published on 21.03"
