,country,countrystd,date,date1,date2,lat,lon,text,source,alltext
58,Greece,Greece,19.03.2020,2020-03-19,20200319,39.051181166727496,22.97481899633821," 1. Passengers are not allowed to enter Greece. - This does not apply to nationals of Austria, Belgium, Bulgaria, Croatia, Cyprus, Czechia, Denmark, Estonia, Finland, France, Germany, Greece, Hungary, Iceland, Ireland (Rep.), Italy, Latvia, Liechtenstein, Lithuania, Luxembourg, Malta, Netherlands, Norway, Poland, Portugal, Romania, Slovakia, Slovenia, Spain, Sweden or Switzerland. - This does not apply to family members of nationals of Austria, Belgium, Bulgaria, Croatia, Cyprus, Czechia, Denmark, Estonia, Finland, France, Germany, Greece, Hungary, Iceland, Ireland (Rep.), Italy, Latvia, Liechtenstein, Lithuania, Luxembourg, Malta, Netherlands, Norway, Poland, Portugal, Romania, Slovakia, Slovenia, Spain, Sweden or Switzerland. - This does not apply to passengers with a British passport and their family members. - This does not apply to passengers with a residence permit issued by Austria, Belgium, Bulgaria, Croatia, Cyprus, Czechia, Denmark, Estonia, Finland, France, Germany, Greece, Hungary, Iceland, Ireland (Rep.), Italy, Latvia, Liechtenstein, Lithuania, Luxembourg, Malta, Netherlands, Norway, Poland, Portugal, Romania, Slovakia, Slovenia, Spain, Sweden, Switzerland or United Kingdom. - This does not apply to passengers with a long term visa issued by Austria, Belgium, Bulgaria, Croatia, Cyprus, Czechia, Denmark, Estonia, Finland, France, Germany, Greece, Hungary, Iceland, Ireland (Rep.), Italy, Latvia, Liechtenstein, Lithuania, Luxembourg, Malta, Netherlands, Norway, Poland, Portugal, Romania, Slovakia, Slovenia, Spain, Sweden, Switzerland or United Kingdom. - This does not apply to the following passengers a. Healthcare professionals and health researchers designated to support the national health care system. b. government members, diplomats, staff of international organizations, military personnel and humanitarian aid workers in the exercise of their duties. c. passengers in transit. d. Aircraft flight crew. e. passengers travelling for imperative family or business reasons provided that the relevant authorization has been obtained by the Greek embassy/consulate. 2. Passengers are required to be in isolation for a period of 14 days. - This does not apply to airline crew.   Prime Minister Kyriakos Mitsotakis is expected to announce the suspension of all passenger flights to and from Greece on Thursday 19 March in a televised address expected later in the afternoon, as the government ramps up measures to limit the spread of the novel coronavirus.  According to information, the suspension will take effect on Sunday night 22 March. ", https://www.iatatravelcentre.com/international-travel-document-news/1580226297.htm ,"Greece: 1. Passengers are not allowed to enter Greece. - This does not apply to nationals of Austria, Belgium, Bulgaria, Croatia, Cyprus, Czechia, Denmark, Estonia, Finland, France, Germany, Greece, Hungary, Iceland, Ireland (Rep.), Italy, Latvia, Liechtenstein, Lithuania, Luxembourg, Malta, Netherlands, Norway, Poland, Portugal, Romania, Slovakia, Slovenia, Spain, Sweden or Switzerland. - This does not apply to family members of nationals of Austria, Belgium, Bulgaria, Croatia, Cyprus, Czechia, Denmark, Estonia, Finland, France, Germany, Greece, Hungary, Iceland, Ireland (Rep.), Italy, Latvia, Liechtenstein, Lithuania, Luxembourg, Malta, Netherlands, Norway, Poland, Portugal, Romania, Slovakia, Slovenia, Spain, Sweden or Switzerland. - This does not apply to passengers with a British passport and their family members. - This does not apply to passengers with a residence permit issued by Austria, Belgium, Bulgaria, Croatia, Cyprus, Czechia, Denmark, Estonia, Finland, France, Germany, Greece, Hungary, Iceland, Ireland (Rep.), Italy, Latvia, Liechtenstein, Lithuania, Luxembourg, Malta, Netherlands, Norway, Poland, Portugal, Romania, Slovakia, Slovenia, Spain, Sweden, Switzerland or United Kingdom. - This does not apply to passengers with a long term visa issued by Austria, Belgium, Bulgaria, Croatia, Cyprus, Czechia, Denmark, Estonia, Finland, France, Germany, Greece, Hungary, Iceland, Ireland (Rep.), Italy, Latvia, Liechtenstein, Lithuania, Luxembourg, Malta, Netherlands, Norway, Poland, Portugal, Romania, Slovakia, Slovenia, Spain, Sweden, Switzerland or United Kingdom. - This does not apply to the following passengers: a. Healthcare professionals and health researchers designated to support the national health care system. b. government members, diplomats, staff of international organizations, military personnel and humanitarian aid workers in the exercise of their duties. c. passengers in transit. d. Aircraft flight crew. e. passengers travelling for imperative family or business reasons provided that the relevant authorization has been obtained by the Greek embassy/consulate. 2. Passengers are required to be in isolation for a period of 14 days. - This does not apply to airline crew.   Prime Minister Kyriakos Mitsotakis is expected to announce the suspension of all passenger flights to and from Greece on Thursday 19 March in a televised address expected later in the afternoon, as the government ramps up measures to limit the spread of the novel coronavirus.  According to information, the suspension will take effect on Sunday night 22 March. Source: https://www.iatatravelcentre.com/international-travel-document-news/1580226297.htm Published on 19.03"
59,Gaza,Palestine,19.03.2020,2020-03-19,20200319,31.91608337961054,35.19781236515579," Gaza crossings closed in both directions. Even if approval to exit Gaza is given, international personnel can only enter Israel if they have not travelled abroad in the previous 14 days. International personnel inside Gaza who entered Israel less than 14 days before, must travel directly to Allenby or to Ben Gurion Airport 6 hours before the flight (GOI). ", Sources ,"Gaza: Gaza crossings closed in both directions. Even if approval to exit Gaza is given, international personnel can only enter Israel if they have not travelled abroad in the previous 14 days. International personnel inside Gaza who entered Israel less than 14 days before, must travel directly to Allenby or to Ben Gurion Airport 6 hours before the flight (GOI). Source: Sources Published on 19.03"
60,French Polynesia,Fr. Polynesia,19.03.2020,2020-03-19,20200319,-15.188779595798124,-145.0520403583545," Passengers are not allowed to enter French Polynesia. -This does not apply to residents of French Polynesia. They must have a “Carte de resident"" with a validity of 10 years. ", https://www.iata.org/contentassets/4ce2b0f630de4c23bd791324c515622b/french-polynesia-ncov-measures.pdf ,"French Polynesia: Passengers are not allowed to enter French Polynesia. -This does not apply to residents of French Polynesia. They must have a “Carte de resident"" with a validity of 10 years. Source: https://www.iata.org/contentassets/4ce2b0f630de4c23bd791324c515622b/french-polynesia-ncov-measures.pdf Published on 19.03"
61,European Union,European Union,19.03.2020,2020-03-19,20200319,,," international restrictions On 17 March, he European Union announced an IMMEDIATE SEALING of the borders for at least 30 days of the 26 Schengen Area countries, 22 of which are in the EU. The ban will affect all non-EU nationals except long-term residents, family members of EU nationals and diplomats, cross-border and healthcare workers, and people transporting goods. Iceland, Liechtenstein, Norway and Switzerland UK citizens will be unaffected. The Ireland/Northern Ireland border is not affected. Internal travel within the EU remains based upon each countries’ respective restrictions. ", UNHAS ,"European Union: international restrictions: On 17 March, he European Union announced an IMMEDIATE SEALING of the borders for at least 30 days of the 26 Schengen Area countries, 22 of which are in the EU. The ban will affect all non-EU nationals except long-term residents, family members of EU nationals and diplomats, cross-border and healthcare workers, and people transporting goods. Iceland, Liechtenstein, Norway and Switzerland UK citizens will be unaffected. The Ireland/Northern Ireland border is not affected. Internal travel within the EU remains based upon each countries’ respective restrictions. Source: UNHAS Published on 19.03"
62,Democratic Republic of the Congo,Congo,19.03.2020,2020-03-19,20200319,-0.8388799890819546,15.218336155911782," As of this Friday 20 March 2020, all flights from countries at risk of COVID-19 and from transit countries are suspended. Only airplanes and cargo ships and other means of freight transport will be authorized to enter the national territory and their personnel subject to controls. Passengers residing in countries at risk are not allowed to enter until further notice. All passengers, upon arrival must complete an information sheet. Also, there will be temperature checks.All travellers coming from countries designated as high-risk by the Government of DRC will be subject to 14 days mandatory self-quarantine. These measures are in place even for travellers showing no symptoms of coronavirus. Those presenting symptoms may be transferred to local health centres for further examination by health professionals. Temperature checks will also be carried out at all maritime, river, lake and land entry points in the national territory and for people leaving Kinshasa to the various provinces of the country in order to prevent the spread of the pandemic to the rest of our country. ", https://www.gov.uk/foreign-travel-advice/democratic-republic-of-the-congo/health#coronavirus ,"Democratic Republic of the Congo: As of this Friday 20 March 2020, all flights from countries at risk of COVID-19 and from transit countries are suspended. Only airplanes and cargo ships and other means of freight transport will be authorized to enter the national territory and their personnel subject to controls. Passengers residing in countries at risk are not allowed to enter until further notice. All passengers, upon arrival must complete an information sheet. Also, there will be temperature checks.All travellers coming from countries designated as high-risk by the Government of DRC will be subject to 14 days mandatory self-quarantine. These measures are in place even for travellers showing no symptoms of coronavirus. Those presenting symptoms may be transferred to local health centres for further examination by health professionals. Temperature checks will also be carried out at all maritime, river, lake and land entry points in the national territory and for people leaving Kinshasa to the various provinces of the country in order to prevent the spread of the pandemic to the rest of our country. Source: https://www.gov.uk/foreign-travel-advice/democratic-republic-of-the-congo/health#coronavirus Published on 19.03"
63,Argentina,Argentina,19.03.2020,2020-03-19,20200319,-35.387551041411754,-65.17819055279396," Government announces nationwide shutdown until March 31 amid COVID-19 outbreak. Borders closed effective immediately until 31 March 2020. All-cargo operations, air crew are exempted but are subject to mandatory quarantine. Foreign travelers in transit through Argentina are allowed entry but must not present any symptoms, must hold outbound ticket and must comply with the requirements set forth by health ministry. Ministry of Transportation has extended the possibility of operating flights from affected areas into Argentina as long as these only carry Argentinian residents. Returning flights will be allowed to transport passengers needing to leave the country. Flights have to be requested to ANAC through same procedure used for regular/non-regular flights (Res. 180). MOT has announced suspension of domestic flights as well as long distance trains and buses as from 00.00 hrs. Fri 20 March 2020 until 00.00 hrs. Wed 25 March 2020. Monday 23 March and Tue 24 March are national holidays so they adopt these measures to decrease circulation of passengers. ", https://www.iata.org/contentassets/a3a5dce2606842b09b0a3d99cede1260/argentina-ncov-measures.pdf ,"Argentina: Government announces nationwide shutdown until March 31 amid COVID-19 outbreak. Borders closed effective immediately until 31 March 2020. All-cargo operations, air crew are exempted but are subject to mandatory quarantine. Foreign travelers in transit through Argentina are allowed entry but must not present any symptoms, must hold outbound ticket and must comply with the requirements set forth by health ministry. Ministry of Transportation has extended the possibility of operating flights from affected areas into Argentina as long as these only carry Argentinian residents. Returning flights will be allowed to transport passengers needing to leave the country. Flights have to be requested to ANAC through same procedure used for regular/non-regular flights (Res. 180). MOT has announced suspension of domestic flights as well as long distance trains and buses as from 00.00 hrs. Fri 20 March 2020 until 00.00 hrs. Wed 25 March 2020. Monday 23 March and Tue 24 March are national holidays so they adopt these measures to decrease circulation of passengers. Source: https://www.iata.org/contentassets/a3a5dce2606842b09b0a3d99cede1260/argentina-ncov-measures.pdf Published on 19.03"
64,Bulgaria,Bulgaria,19.03.2020,2020-03-19,20200319,42.768522582229735,25.217512624510874," The Bulgarian government has banned the entry of travelers from the following 15 countries beginning March 18 Italy, Spain, Iran, Republic of Korea, China, France, Germany, United Kingdom, Switzerland, The Netherlands, India, Bangladesh, Maldives, Nepal, and Sri Lanka. These restrictions do not apply to Bulgarian citizens and their family members, or persons with permanent or long term residence permits and members of their families. Travellers in Bulgaria still have movement capabilities to neighboring countries. Border Crossings with North Macedonia, Serbia, and Romania have been reduced to a few points of entry with many smaller border crossings closed. The closures, together with enhanced inspections are leading to long lines of slow-moving vehicles, with reports of lengthy delays at the Turkish border. Borders with Greece and Turkey are still open to Bulgarians and Americans, though the train service is suspended. These measures are being implemented by neighboring countries. From midnight on March 17 flights from Italy and Spain to Bulgaria will be suspended.  Bulgaria has temporarily barred admission to (non-EU) nationals, including U.S. citizens, beginning March 20, 2020, at 1200 a.m. and until April 17. This includes all border crossing points with any means of transport, including aviation, maritime, rail, and road. The ban does not apply to (1) healthcare professionals, health researchers and elderly care professionals; (2) transport personnel engaged in the carriage of goods, crews of aircraft engaged in commercial air transport and other transport personnel as necessary; (3) diplomats, officials of international organizations, military personnel and humanitarian workers in the performance of their duties; (4) persons traveling for humanitarian reasons; (5) third-country nationals who hold a long-term residence permit in an EU Member State and are transiting Bulgaria to return to their country of residence. ", https://www.osac.gov/Content/Report/8467c69c-7024-4c3d-a3c1-183c8d6d9a41 ,"Bulgaria: The Bulgarian government has banned the entry of travelers from the following 15 countries beginning March 18: Italy, Spain, Iran, Republic of Korea, China, France, Germany, United Kingdom, Switzerland, The Netherlands, India, Bangladesh, Maldives, Nepal, and Sri Lanka. These restrictions do not apply to Bulgarian citizens and their family members, or persons with permanent or long term residence permits and members of their families. Travellers in Bulgaria still have movement capabilities to neighboring countries. Border Crossings with North Macedonia, Serbia, and Romania have been reduced to a few points of entry with many smaller border crossings closed. The closures, together with enhanced inspections are leading to long lines of slow-moving vehicles, with reports of lengthy delays at the Turkish border. Borders with Greece and Turkey are still open to Bulgarians and Americans, though the train service is suspended. These measures are being implemented by neighboring countries. From midnight on March 17 flights from Italy and Spain to Bulgaria will be suspended.  Bulgaria has temporarily barred admission to (non-EU) nationals, including U.S. citizens, beginning March 20, 2020, at 12:00 a.m. and until April 17. This includes all border crossing points with any means of transport, including aviation, maritime, rail, and road. The ban does not apply to: (1) healthcare professionals, health researchers and elderly care professionals; (2) transport personnel engaged in the carriage of goods, crews of aircraft engaged in commercial air transport and other transport personnel as necessary; (3) diplomats, officials of international organizations, military personnel and humanitarian workers in the performance of their duties; (4) persons traveling for humanitarian reasons; (5) third-country nationals who hold a long-term residence permit in an EU Member State and are transiting Bulgaria to return to their country of residence. Source: https://www.osac.gov/Content/Report/8467c69c-7024-4c3d-a3c1-183c8d6d9a41 Published on 19.03"
65,Bolivia,Bolivia,19.03.2020,2020-03-19,20200319,-16.706876859261637,-64.68475356160847," Government to close borders to non-residents and suspend all international flights until 31 March because of COVID-19 . As of 20 March to 31 March 2020, all borders are closed. All-cargo operations, nationals and residents returning, diplomats and international organizations and international crew are exempted. Nationals and residents must comply with health protocols upon arrival.  All passengers to fill out passenger locator forms. As of 21 March, all international flights will be suspended. Only repatriation and humanitarian flights are exempted. ", https://www.iata.org/contentassets/c06667419d584d8b940da7bb280c29b7/bolivia-ncov-measures.pdf ,"Bolivia: Government to close borders to non-residents and suspend all international flights until 31 March because of COVID-19 . As of 20 March to 31 March 2020, all borders are closed. All-cargo operations, nationals and residents returning, diplomats and international organizations and international crew are exempted. Nationals and residents must comply with health protocols upon arrival.  All passengers to fill out passenger locator forms. As of 21 March, all international flights will be suspended. Only repatriation and humanitarian flights are exempted. Source: https://www.iata.org/contentassets/c06667419d584d8b940da7bb280c29b7/bolivia-ncov-measures.pdf Published on 19.03"
66,Bermuda,Bermuda,19.03.2020,2020-03-19,20200319,32.31013657811688,-64.76349138259141," Bermuda airport is set to close to all commercial flights at 1150pm on 20 March 2020 for a two-week period. Only Bermuda residents will be allowed to enter the country via commercial flights prior to the closure. Passengers who have been in China, Chinese Taipei, Iran, Italy (northern regions), Hong Kong (SAR China), Japan, Korea (Rep.), Macau (SAR China), Malaysia, Singapore, Thailand, Vietnam, in the past 14 days are subject to quarantine for a minimum of 14 days. Passengers who show any symptom of Coronavirus (COVID-19) or have a relevant travel history, will be put into immediate isolation. Crew are required to complete health form and will be met upon their arrival to reconfirm travel history and current health status. Crew is exempt of the requirement of self-quarantine. ", https://www.iata.org/contentassets/e077e98a5ebe43b4a82ddf8414b061e6/bermuda-ncov-measures.pdf ,"Bermuda: Bermuda airport is set to close to all commercial flights at 11:50pm on 20 March 2020 for a two-week period. Only Bermuda residents will be allowed to enter the country via commercial flights prior to the closure. Passengers who have been in China, Chinese Taipei, Iran, Italy (northern regions), Hong Kong (SAR China), Japan, Korea (Rep.), Macau (SAR China), Malaysia, Singapore, Thailand, Vietnam, in the past 14 days are subject to quarantine for a minimum of 14 days. Passengers who show any symptom of Coronavirus (COVID-19) or have a relevant travel history, will be put into immediate isolation. Crew are required to complete health form and will be met upon their arrival to reconfirm travel history and current health status. Crew is exempt of the requirement of self-quarantine. Source: https://www.iata.org/contentassets/e077e98a5ebe43b4a82ddf8414b061e6/bermuda-ncov-measures.pdf Published on 19.03"
67,Bahrain,Bahrain,19.03.2020,2020-03-19,20200319,26.052784389654434,50.54661936904843," 1. Visa on arrival has been suspended. - This does not apply to passengers with a diplomatic, an official, a service or UN passport. 2. Passengers who have been in Austria, Belgium, China (People's Rep.), Czechia, Denmark, Estonia, Finland, France, Germany, Greece, Hungary, Iceland, Iran, Iraq, Korea (Rep.), Latvia, Liechtenstein, Lithuania, Luxembourg, Malta, Netherlands, Norway, Poland, Portugal, Slovakia, Slovenia, Spain, Sweden, Switzerland, United Kingdom and USA in the past 14 days are not allowed to transit and enter Bahrain. - This does not apply to nationals of Bahrain, Kuwait, Oman, Qatar, Saudi Arabia and United Arab Emirates. - This does not apply to passengers who reside in Bahrain. - This does not apply to airline crew. - This does not apply to military personnel. - This does not apply to passengers with a special approval from Nationality, Passport Residence Affairs Directorate of Bahrain. - This does not apply to passengers with a valid letter of Prior Permission Granted which is presented prior to boarding. 3. Passengers who have been in Hong Kong (SAR China), Italy, Japan, Lebanon, Malaysia, Singapore or Thailand in the past 14 days must have a valid visa prior to arrival. - This does not apply to nationals of Bahrain, Kuwait, Oman, Qatar, Saudi Arabia and United Arab Emirates. - This does not apply to passengers who reside in Bahrain. - This does not apply to passengers with a valid letter of Prior Permission Granted which is presented prior to boarding. - This does not apply to airline crew. 4. All passengers arriving in Bahrain will immediately be taken to undergo enhanced testing procedures as a preventative measure for Coronavirus (COVID-19) and will be subject to quarantine. 5. Border crossing on the causeway has been temporarily suspended due to Coronavirus (COVID-19). ", https://www.iatatravelcentre.com/international-travel-document-news/1580226297.htm ,"Bahrain: 1. Visa on arrival has been suspended. - This does not apply to passengers with a diplomatic, an official, a service or UN passport. 2. Passengers who have been in Austria, Belgium, China (People's Rep.), Czechia, Denmark, Estonia, Finland, France, Germany, Greece, Hungary, Iceland, Iran, Iraq, Korea (Rep.), Latvia, Liechtenstein, Lithuania, Luxembourg, Malta, Netherlands, Norway, Poland, Portugal, Slovakia, Slovenia, Spain, Sweden, Switzerland, United Kingdom and USA in the past 14 days are not allowed to transit and enter Bahrain. - This does not apply to nationals of Bahrain, Kuwait, Oman, Qatar, Saudi Arabia and United Arab Emirates. - This does not apply to passengers who reside in Bahrain. - This does not apply to airline crew. - This does not apply to military personnel. - This does not apply to passengers with a special approval from Nationality, Passport Residence Affairs Directorate of Bahrain. - This does not apply to passengers with a valid letter of Prior Permission Granted which is presented prior to boarding. 3. Passengers who have been in Hong Kong (SAR China), Italy, Japan, Lebanon, Malaysia, Singapore or Thailand in the past 14 days must have a valid visa prior to arrival. - This does not apply to nationals of Bahrain, Kuwait, Oman, Qatar, Saudi Arabia and United Arab Emirates. - This does not apply to passengers who reside in Bahrain. - This does not apply to passengers with a valid letter of Prior Permission Granted which is presented prior to boarding. - This does not apply to airline crew. 4. All passengers arriving in Bahrain will immediately be taken to undergo enhanced testing procedures as a preventative measure for Coronavirus (COVID-19) and will be subject to quarantine. 5. Border crossing on the causeway has been temporarily suspended due to Coronavirus (COVID-19). Source: https://www.iatatravelcentre.com/international-travel-document-news/1580226297.htm Published on 19.03"
