,country,countrystd,date,date1,date2,lat,lon,text,source,alltext
126,Gambia,Gambia,20.03.2020,2020-03-20,20200320,13.449729559289604,-15.397582032042344," All flights from Austria, Belgium, Denmark, France, Germany, Netherlands, Norway, Poland, Portugal, Spain, Sweden, Switzerland and the UK are suspended until further notice. All travellers from 47 other countries will be subject to a 14-day mandatory quarantine. ", https://pandemic.internationalsos.com/2019-ncov/ncov-travel-restrictions-flight-operations-and-screening ,"Gambia: All flights from Austria, Belgium, Denmark, France, Germany, Netherlands, Norway, Poland, Portugal, Spain, Sweden, Switzerland and the UK are suspended until further notice. All travellers from 47 other countries will be subject to a 14-day mandatory quarantine. Source: https://pandemic.internationalsos.com/2019-ncov/ncov-travel-restrictions-flight-operations-and-screening Published on 20.03"
127,Georgia,Georgia,20.03.2020,2020-03-20,20200320,42.16880077709315,43.507526330443156," As of 15 March the country suspends all international flights because of COVID-19. 1. Passengers are not allowed to enter Georgia.  - This does not apply to nationals and residents of Georgia.  - This does not apply to airline crew. - This does not apply to representatives of diplomatic missions and international organizations and their family members accredited to Georgia. - This does not apply to mixed families where one of the spouses or their under age child is a citizen of Georgia. - This does not apply to passengers who are part of the humanitarian mission if trip of such mission (doctors, volunteers) becomes a necessity. - This does not apply to passengers who have been granted the status of stateless persons by respective authorities of Georgia. - This does not apply to passengers who are holding status neutral travel documents. - This does not apply to passengers with a refugee status in Georgia.  2. Passengers with a residence permit issued by Georgia must get an OKTOBOARD before departing for Georgia. Batumi International Airport (BUS) and David the Builder Kutaisi International Airport (KUT) have been closed until further notice. The movement of citizens between Armenia, Azerbaijan and Georgia is suspended at least until 24 March. "," Reuters, https://www.iatatravelcentre.com/international-travel-document-news/1580226297.htm https://pandemic.internationalsos.com/2019-ncov/ncov-travel-restrictions-flight-operations-and-screening ","Georgia: As of 15 March the country suspends all international flights because of COVID-19. 1. Passengers are not allowed to enter Georgia.  - This does not apply to nationals and residents of Georgia.  - This does not apply to airline crew. - This does not apply to representatives of diplomatic missions and international organizations and their family members accredited to Georgia. - This does not apply to mixed families where one of the spouses or their under age child is a citizen of Georgia. - This does not apply to passengers who are part of the humanitarian mission if trip of such mission (doctors, volunteers) becomes a necessity. - This does not apply to passengers who have been granted the status of stateless persons by respective authorities of Georgia. - This does not apply to passengers who are holding status neutral travel documents. - This does not apply to passengers with a refugee status in Georgia.  2. Passengers with a residence permit issued by Georgia must get an OKTOBOARD before departing for Georgia. Batumi International Airport (BUS) and David the Builder Kutaisi International Airport (KUT) have been closed until further notice. The movement of citizens between Armenia, Azerbaijan and Georgia is suspended at least until 24 March. Source: Reuters, https://www.iatatravelcentre.com/international-travel-document-news/1580226297.htm https://pandemic.internationalsos.com/2019-ncov/ncov-travel-restrictions-flight-operations-and-screening Published on 20.03"
128,Germany,Germany,20.03.2020,2020-03-20,20200320,51.10636346852256,10.38149388735357," Borders partially closed, specifically with Austria, Denmark, France, Luxembourg and Switzerland (16 March). The restrictions do not affect the flow of goods and commerce. Commuters can continue to cross the borders. Germans and residents from the five countries can also cross the border to return home. Germany also has borders with the Netherlands, Poland and the Czech Republic; there is no suggestion that these have been closed. Due to many recent travel restrictions Germany has advised its citizens against non-essential travels to other countries. As of 18 March entry restrictions were expanded to include flights from Italy, Spain, Austria, France, Luxembourg, Denmark and Switzerland.  The new entry restrictions also apply to sea transport from Denmark, an interior ministry spokesman said. Direct flights with Iran are suspended. Flights to and from Italy have stopped until further notice. ", Sources ,"Germany: Borders partially closed, specifically with Austria, Denmark, France, Luxembourg and Switzerland (16 March). The restrictions do not affect the flow of goods and commerce. Commuters can continue to cross the borders. Germans and residents from the five countries can also cross the border to return home. Germany also has borders with the Netherlands, Poland and the Czech Republic; there is no suggestion that these have been closed. Due to many recent travel restrictions Germany has advised its citizens against non-essential travels to other countries. As of 18 March entry restrictions were expanded to include flights from Italy, Spain, Austria, France, Luxembourg, Denmark and Switzerland.  The new entry restrictions also apply to sea transport from Denmark, an interior ministry spokesman said. Direct flights with Iran are suspended. Flights to and from Italy have stopped until further notice. Source: Sources Published on 20.03"
129,Oman,Oman,20.03.2020,2020-03-20,20200320,20.601805718801195,56.09265663598474," International restrictions ›As of 18 March, all non-Omani nationals will be barred entry until further notice. This ban includes Gulf Cooperation Council (GCC) citizens and foreign nationals holding valid tourist, business and residency visas. Airport transits remain unaffected. Foreign nationals will be permitted to depart the country during this time, although Omani citizens will not be. Exceptions for Omanis may be made on a case-by-case basis. ", https://pandemic.internationalsos.com/2019-ncov/ncov-travel-restrictions-flight-operations-and-screening ,"Oman: International restrictions: ›As of 18 March, all non-Omani nationals will be barred entry until further notice. This ban includes Gulf Cooperation Council (GCC) citizens and foreign nationals holding valid tourist, business and residency visas. Airport transits remain unaffected. Foreign nationals will be permitted to depart the country during this time, although Omani citizens will not be. Exceptions for Omanis may be made on a case-by-case basis. Source: https://pandemic.internationalsos.com/2019-ncov/ncov-travel-restrictions-flight-operations-and-screening Published on 20.03"
130,Cook Islands,Cook Is.,20.03.2020,2020-03-20,20200320,-19.814980933098305,-158.79110431852448," Persons intending to travel to the Cook Islands having originated from or transited through any country except New Zealand within 14 days prior to travel will be denied entry into the Cook Islands. Such persons intending to travel to the Cook Islands must have self-isolated for a minimum of 14 days in New Zealand prior to travel to the Cook Islands. Provision of medical clearance for travel issued within 3 days of travel to the Cook Islands must be produced on check in with airlines. Cook Islanders and Cook Islands residents who travel to New Zealand after these restrictions take effect will be required to self-isolate in New Zealand for 14 days prior to intended return travel to the Cook Islands with the exception of professional medical personnel escorting medical patients to New Zealand. Provision of medical clearance for travel issued within 3 days of travel to the Cook Islands must be produced on check in with airlines. Travelers who breach these restrictions will be refused entry on arrival to the Cook Islands. A temporary ban on the entry of all cruise ships, yachts and leisure crafts to the Cook Islands territorial waters will come into effect on Monday 16 March 2020 2359 and remain in place until 30 June 2020 2359. ", https://www.facebook.com/252224024943845/posts/1525556087610626/ ,"Cook Islands: Persons intending to travel to the Cook Islands having originated from or transited through any country except New Zealand within 14 days prior to travel will be denied entry into the Cook Islands. Such persons intending to travel to the Cook Islands must have self-isolated for a minimum of 14 days in New Zealand prior to travel to the Cook Islands. Provision of medical clearance for travel issued within 3 days of travel to the Cook Islands must be produced on check in with airlines. Cook Islanders and Cook Islands residents who travel to New Zealand after these restrictions take effect will be required to self-isolate in New Zealand for 14 days prior to intended return travel to the Cook Islands with the exception of professional medical personnel escorting medical patients to New Zealand. Provision of medical clearance for travel issued within 3 days of travel to the Cook Islands must be produced on check in with airlines. Travelers who breach these restrictions will be refused entry on arrival to the Cook Islands. A temporary ban on the entry of all cruise ships, yachts and leisure crafts to the Cook Islands territorial waters will come into effect on Monday 16 March 2020 23:59 and remain in place until 30 June 2020 23:59. Source: https://www.facebook.com/252224024943845/posts/1525556087610626/ Published on 20.03"
131,Congo,Congo,20.03.2020,2020-03-20,20200320,-0.8388799890819546,15.218336155911782," International restrictions ›All travellers should reportedly present a COVID-19 negative test, carried out by an approved institution, to apply for any type of visa. Further indication on entry requirements should be discussed with the country’s diplomatic representations prior travel. ›All travellers coming from areas most at risk, including currently China, Iran, EU or South Korea will be quarantined for 14 days upon entry. ›On 16 March it was announced that all flights to affected countries will be suspended from 19 March. ", https://pandemic.internationalsos.com/2019-ncov/ncov-travel-restrictions-flight-operations-and-screening ,"Congo: International restrictions: ›All travellers should reportedly present a COVID-19 negative test, carried out by an approved institution, to apply for any type of visa. Further indication on entry requirements should be discussed with the country’s diplomatic representations prior travel. ›All travellers coming from areas most at risk, including currently China, Iran, EU or South Korea will be quarantined for 14 days upon entry. ›On 16 March it was announced that all flights to affected countries will be suspended from 19 March. Source: https://pandemic.internationalsos.com/2019-ncov/ncov-travel-restrictions-flight-operations-and-screening Published on 20.03"
132,Chile,Chile,20.03.2020,2020-03-20,20200320,-37.74360612189036,-71.36437424947059," Chile entered a 90-day National State of Catastrophe on March 18. As part of this government-mandated confinement period, it has prohibited all international travel by air, road, sea and river transportation. Al-cargo operations and crew are excluded. Nationals and residents coming from high-risk zones subject to 14 day quarantine. ", Sources ,"Chile: Chile entered a 90-day National State of Catastrophe on March 18. As part of this government-mandated confinement period, it has prohibited all international travel by air, road, sea and river transportation. Al-cargo operations and crew are excluded. Nationals and residents coming from high-risk zones subject to 14 day quarantine. Source: Sources Published on 20.03"
133,Afghanistan,Afghanistan,20.03.2020,2020-03-20,20200320,33.8362669104371,66.00844744953932," The Afghan authorities have introduced a number of measures to limit the spread of the virus including point of entry screening at 3 international airports and 11 international crossings. Not everyone is being screened, but those who are and who show a temperature (of more than 38 degrees Celsius) may be quarantined and sent direct to one of 2 national hospitals (Kabul Infectious Disease and Afghan-Japan Communicable Disease Hospital in Kabul) or 5 provincial hospitals for isolation. These hospitals are outside of the Enhanced Security Zone. You should comply with any additional screening measures put in place by the authorities.The National Security Council of Afghanistan has announced that all travel to and from Iran has been temporarily banned to limit the spread of coronavirus. The border with China remains closed. Travellers who have been to China and Iran in the past month are divided from other passengers for medical checks. Those with COVID-19 symptoms are taken to a designated medical facility for further medical tests while those without symptoms are advised to quarantine at home for 14 days. "," UNHAS (source: Media, International SOS) ","Afghanistan: The Afghan authorities have introduced a number of measures to limit the spread of the virus including point of entry screening at 3 international airports and 11 international crossings. Not everyone is being screened, but those who are and who show a temperature (of more than 38 degrees Celsius) may be quarantined and sent direct to one of 2 national hospitals (Kabul Infectious Disease and Afghan-Japan Communicable Disease Hospital in Kabul) or 5 provincial hospitals for isolation. These hospitals are outside of the Enhanced Security Zone. You should comply with any additional screening measures put in place by the authorities.The National Security Council of Afghanistan has announced that all travel to and from Iran has been temporarily banned to limit the spread of coronavirus. The border with China remains closed. Travellers who have been to China and Iran in the past month are divided from other passengers for medical checks. Those with COVID-19 symptoms are taken to a designated medical facility for further medical tests while those without symptoms are advised to quarantine at home for 14 days. Source: UNHAS (source: Media, International SOS) Published on 20.03"
134,Albania,Albania,20.03.2020,2020-03-20,20200320,41.14248198206188,20.053819192898068," ›All flights and ferries to/from Northern Italy and all red areas are suspended until 3 April. ›All travellers entering the country, who have travelled to WHO high-risk regions for COVID-19 in the past 14 days, have been ordered to self-quarantine for 14 days. All travellers from Italy are barred entry until further notice. ›The land borders with Greece, Kosovo, Montenegro and North Macedonia have been closed until further notice. Internal restrictions ›Private car traffic and interurban transport will be banned across eight cities Durres, Elbasan, Fier, Lezha, Lushnje, Shkodra, Tirana and Vlor between 13 March 06.00 and 16 March 00.00. Roads connecting Tirana and Durres to other parts of the country will also be closed during this timeframe and public transportation closed between/within the two cities. ›Textile manufacturers and call centres, as well as all activities within shopping malls not related to bakeries, groceries and pharmaceutical services will be closed until further notice. ›Large gatherings, sporting events and conferences are banned. Schools and universities will be suspended until 23 March. ", https://pandemic.internationalsos.com/2019-ncov/ncov-travel-restrictions-flight-operations-and-screening ,"Albania: ›All flights and ferries to/from Northern Italy and all red areas are suspended until 3 April. ›All travellers entering the country, who have travelled to WHO high-risk regions for COVID-19 in the past 14 days, have been ordered to self-quarantine for 14 days. All travellers from Italy are barred entry until further notice. ›The land borders with Greece, Kosovo, Montenegro and North Macedonia have been closed until further notice. Internal restrictions: ›Private car traffic and interurban transport will be banned across eight cities: Durres, Elbasan, Fier, Lezha, Lushnje, Shkodra, Tirana and Vlor between 13 March 06.00 and 16 March 00.00. Roads connecting Tirana and Durres to other parts of the country will also be closed during this timeframe and public transportation closed between/within the two cities. ›Textile manufacturers and call centres, as well as all activities within shopping malls not related to bakeries, groceries and pharmaceutical services will be closed until further notice. ›Large gatherings, sporting events and conferences are banned. Schools and universities will be suspended until 23 March. Source: https://pandemic.internationalsos.com/2019-ncov/ncov-travel-restrictions-flight-operations-and-screening Published on 20.03"
135,Algeria,Algeria,20.03.2020,2020-03-20,20200320,28.1488896573307,2.653091376797363," International restrictions ›All international flight suspended ›All ferries suspended Internal restrictions ›Internal travel restrictions announced on 18 March will last from 22 March until 4 April, and will cover the suspension of domestic flights, rail links and other types of public transport. Restaurants and cafes will also be temporarily closed in major cities. ›All public gatherings in Algeria suspended until further notice (including religious prayers and protests) ", https://pandemic.internationalsos.com/2019-ncov/ncov-travel-restrictions-flight-operations-and-screening ,"Algeria: International restrictions: ›All international flight suspended ›All ferries suspended Internal restrictions: ›Internal travel restrictions announced on 18 March will last from 22 March until 4 April, and will cover the suspension of domestic flights, rail links and other types of public transport. Restaurants and cafes will also be temporarily closed in major cities. ›All public gatherings in Algeria suspended until further notice (including religious prayers and protests) Source: https://pandemic.internationalsos.com/2019-ncov/ncov-travel-restrictions-flight-operations-and-screening Published on 20.03"
136,Bahamas,Bahamas,20.03.2020,2020-03-20,20200320,24.22280928156868,-76.55125221251895," Inbound restrictions ›Foreign nationals have been barred from entry if they were on the Diamond Princess cruise ship. They will be allowed entry after completing a 14-day quarantine period after leaving the ship. ›Foreigners who have travelled from Ireland, mainland Europe or the UK, China, Iran, Italy or South Korea within the last 20 days will be denied entry to the islands. Residents coming from impacted areas will be forced to quarantine or self-isolate upon arrival. Outbound restrictions ›There are currently no known restrictions on individuals seeking to depart the country. Residents of the Bahamas who have been in China (People's Rep.), Europe, Iran, Italy, Korea (Rep.) or United Kingdom will be subject to immediate quarantine for a maximum of 14 days. ", https://pandemic.internationalsos.com/2019-ncov/ncov-travel-restrictions-flight-operations-and-screening ,"Bahamas: Inbound restrictions: ›Foreign nationals have been barred from entry if they were on the Diamond Princess cruise ship. They will be allowed entry after completing a 14-day quarantine period after leaving the ship. ›Foreigners who have travelled from Ireland, mainland Europe or the UK, China, Iran, Italy or South Korea within the last 20 days will be denied entry to the islands. Residents coming from impacted areas will be forced to quarantine or self-isolate upon arrival. Outbound restrictions: ›There are currently no known restrictions on individuals seeking to depart the country. Residents of the Bahamas who have been in China (People's Rep.), Europe, Iran, Italy, Korea (Rep.) or United Kingdom will be subject to immediate quarantine for a maximum of 14 days. Source: https://pandemic.internationalsos.com/2019-ncov/ncov-travel-restrictions-flight-operations-and-screening Published on 20.03"
137,Belgium,Belgium,20.03.2020,2020-03-20,20200320,50.63746163645221,4.639960503260021," Belgium's Charleroi airport said on Friday it would close for business from 2359 CET on March 24 to April 5, with a possibility to extend that period, because airlines have suspended flights due to the coronavirus epidemic. All non-essential travel abroad is prohibited. ", Reuters ,"Belgium: Belgium's Charleroi airport said on Friday it would close for business from 23:59 CET on March 24 to April 5, with a possibility to extend that period, because airlines have suspended flights due to the coronavirus epidemic. All non-essential travel abroad is prohibited. Source: Reuters Published on 20.03"
138,Benin,Benin,20.03.2020,2020-03-20,20200320,9.641216769508835,2.3287407454765696, International restrictions ›Borders are closed for non-essential travel. Issuing of new visas has been suspended. ›All travellers arriving by air will have to go into quarantine for 14 days. Non-nationals will have to pay the associated costs themselves. ›All land borders are closed to all but emergency movements deemed necessary by the government. , https://pandemic.internationalsos.com/2019-ncov/ncov-travel-restrictions-flight-operations-and-screening ,Benin: International restrictions: ›Borders are closed for non-essential travel. Issuing of new visas has been suspended. ›All travellers arriving by air will have to go into quarantine for 14 days. Non-nationals will have to pay the associated costs themselves. ›All land borders are closed to all but emergency movements deemed necessary by the government. Source: https://pandemic.internationalsos.com/2019-ncov/ncov-travel-restrictions-flight-operations-and-screening Published on 20.03
139,Bhutan,Bhutan,20.03.2020,2020-03-20,20200320,27.421756562354876,90.40446020115762," International restrictions ›From 17 March, all remaining travellers, including Bhutanese nationals, who are able to enter the country are subject to mandatory quarantine in a facility for 14 days. ›Travellers with a travel history to COVID-19 affected countries within 14 days prior to arrival are requested to report to the health desk at the point of entry. ›Following the first confirmed case on 6 March, a 14-day restriction is in place on all incoming tourists with immediate effect. Diplomats and residents will have to undergo medical screening and further preventive measures. ", https://pandemic.internationalsos.com/2019-ncov/ncov-travel-restrictions-flight-operations-and-screening ,"Bhutan: International restrictions: ›From 17 March, all remaining travellers, including Bhutanese nationals, who are able to enter the country are subject to mandatory quarantine in a facility for 14 days. ›Travellers with a travel history to COVID-19 affected countries within 14 days prior to arrival are requested to report to the health desk at the point of entry. ›Following the first confirmed case on 6 March, a 14-day restriction is in place on all incoming tourists with immediate effect. Diplomats and residents will have to undergo medical screening and further preventive measures. Source: https://pandemic.internationalsos.com/2019-ncov/ncov-travel-restrictions-flight-operations-and-screening Published on 20.03"
140,Ghana,Ghana,20.03.2020,2020-03-20,20200320,7.953954766209764,-1.2165237995320377," 1. As of 17 March passengers who have been in countries with more than 200 confirmed cases of coronavirus (COVID-19) in the past 14 days are not allowed to enter Ghana. - This does not apply to nationals and residents of Ghana. 2. Nationals and residents of Ghana will be subjected to self-quarantine. 3. Any admissible passenger, who exhibits symptoms of Covid-19 will be quarantined and tested. Tightened health control measures for arriving travellers. thermal screenings are provided and for passengers who experience symptoms, a special area has been identified in which these passengers will be detained pending the results of the necessary checks. ", https://www.iatatravelcentre.com/international-travel-document-news/1580226297.htm https://pandemic.internationalsos.com/2019-ncov/ncov-travel-restrictions-flight-operations-and-screening ,"Ghana: 1. As of 17 March passengers who have been in countries with more than 200 confirmed cases of coronavirus (COVID-19) in the past 14 days are not allowed to enter Ghana. - This does not apply to nationals and residents of Ghana. 2. Nationals and residents of Ghana will be subjected to self-quarantine. 3. Any admissible passenger, who exhibits symptoms of Covid-19 will be quarantined and tested. Tightened health control measures for arriving travellers. thermal screenings are provided and for passengers who experience symptoms, a special area has been identified in which these passengers will be detained pending the results of the necessary checks. Source: https://www.iatatravelcentre.com/international-travel-document-news/1580226297.htm https://pandemic.internationalsos.com/2019-ncov/ncov-travel-restrictions-flight-operations-and-screening Published on 20.03"
